{
  "$schema": "https://json-schema.org/draft/2020-12/schema",
  "$id": "urn:connect:d02:a9:snapshot-schema:1",
  "title": "Connect D02-A9 planning snapshot",
  "type": "object",
  "additionalProperties": false,
  "required": [
    "artifactId",
    "schemaVersion",
    "snapshotId",
    "snapshotClass",
    "generatedAt",
    "safeState",
    "rootStates",
    "evidenceStates",
    "currentTerminal"
  ],
  "properties": {
    "artifactId": {
      "const": "CONNECT-D02-A9-CURRENT-BLOCKED-SNAPSHOT-2026-08-30"
    },
    "schemaVersion": {
      "const": "1.0.0"
    },
    "snapshotId": {
      "type": "string",
      "pattern": "^D02A9-SNAPSHOT-[0-9]{3}$"
    },
    "snapshotClass": {
      "const": "CURRENT-NON-AUTHORIZING-PLANNING-SNAPSHOT"
    },
    "generatedAt": {
      "type": "string",
      "pattern": "^[0-9]{4}-[0-9]{2}-[0-9]{2}T[0-9]{2}:[0-9]{2}:[0-9]{2}Z$"
    },
    "safeState": {
      "$ref": "#/$defs/safeState"
    },
    "rootStates": {
      "type": "array",
      "minItems": 3,
      "maxItems": 3,
      "uniqueItems": true,
      "items": {
        "$ref": "#/$defs/rootState"
      }
    },
    "evidenceStates": {
      "type": "array",
      "minItems": 13,
      "maxItems": 13,
      "uniqueItems": true,
      "items": {
        "$ref": "#/$defs/evidenceState"
      }
    },
    "currentTerminal": {
      "const": "PROFILE-NOT-ADMITTED"
    }
  },
  "$defs": {
    "safeState": {
      "type": "object",
      "additionalProperties": false,
      "required": [
        "aiRuntime",
        "gate29",
        "developmentFreeze",
        "repositoryVisibility",
        "planningAcceptance",
        "aiAdmission",
        "runtimePermit",
        "acceptanceCount"
      ],
      "properties": {
        "aiRuntime": {
          "const": "OFF"
        },
        "gate29": {
          "const": "BLOCKED"
        },
        "developmentFreeze": {
          "const": "ACTIVE"
        },
        "repositoryVisibility": {
          "const": "PUBLIC"
        },
        "planningAcceptance": {
          "const": "MISSING"
        },
        "aiAdmission": {
          "const": "MISSING"
        },
        "runtimePermit": {
          "const": "MISSING"
        },
        "acceptanceCount": {
          "type": "integer",
          "minimum": 0,
          "maximum": 0
        }
      }
    },
    "rootState": {
      "type": "object",
      "additionalProperties": false,
      "required": [
        "ordinal",
        "rootId",
        "rootClass",
        "state",
        "rootSha256",
        "version",
        "acceptanceCredit"
      ],
      "properties": {
        "ordinal": {
          "type": "integer",
          "minimum": 1,
          "maximum": 3
        },
        "rootId": {
          "type": "string",
          "enum": [
            "D02A9-ROOT-PLANNING-ACCEPTANCE",
            "D02A9-ROOT-AI-ADMISSION",
            "D02A9-ROOT-RUNTIME-PERMIT"
          ]
        },
        "rootClass": {
          "type": "string",
          "enum": [
            "D02-PLANNING-CONTRACT-ACCEPTANCE",
            "AI-PROFILE-ADMISSION",
            "AI-RUNTIME-PERMIT"
          ]
        },
        "state": {
          "type": "string",
          "enum": [
            "MISSING",
            "PRESENT-UNACCEPTED",
            "ACCEPTED",
            "EXPIRED",
            "REVOKED",
            "CONSUMED",
            "BLOCKED"
          ]
        },
        "rootSha256": {
          "type": "string",
          "pattern": "^(?:MISSING|[0-9a-f]{64})$"
        },
        "version": {
          "type": "integer",
          "minimum": 0,
          "maximum": 2147483647
        },
        "acceptanceCredit": {
          "type": "integer",
          "minimum": 0,
          "maximum": 1
        }
      }
    },
    "evidenceState": {
      "type": "object",
      "additionalProperties": false,
      "required": [
        "ordinal",
        "evidenceId",
        "state",
        "rootSha256",
        "acceptanceCredit"
      ],
      "properties": {
        "ordinal": {
          "type": "integer",
          "minimum": 1,
          "maximum": 13
        },
        "evidenceId": {
          "type": "string",
          "pattern": "^D02A9-EVIDENCE-[0-9]{3}$"
        },
        "state": {
          "type": "string",
          "enum": [
            "MISSING",
            "PRESENT-UNACCEPTED",
            "ACCEPTED",
            "EXPIRED",
            "REVOKED",
            "BLOCKED"
          ]
        },
        "rootSha256": {
          "type": "string",
          "pattern": "^(?:MISSING|[0-9a-f]{64})$"
        },
        "acceptanceCredit": {
          "type": "integer",
          "minimum": 0,
          "maximum": 1
        }
      }
    }
  }
}
